{
  "documentId": "MRPL-CDU-01",
  "sheetNumber": "01",
  "tags": [
    {
      "tagId": "tag-V-101",
      "tagNumber": "V-101",
      "symbolClass": "pressure-vessel",
      "lineNumber": "Feed Surge Drum",
      "detectorConfidence": 1,
      "ocrConfidence": 1,
      "bbox": {
        "page": 1,
        "x": 150,
        "y": 350,
        "w": 90,
        "h": 140
      }
    },
    {
      "tagId": "tag-GV-1001",
      "tagNumber": "GV-1001",
      "symbolClass": "gate-valve",
      "lineNumber": "Suction Isolation",
      "detectorConfidence": 1,
      "ocrConfidence": 1,
      "bbox": {
        "page": 1,
        "x": 380,
        "y": 400,
        "w": 50,
        "h": 40
      }
    },
    {
      "tagId": "tag-P-101A",
      "tagNumber": "P-101A",
      "symbolClass": "centrifugal-pump",
      "lineNumber": "Charge Pump",
      "detectorConfidence": 1,
      "ocrConfidence": 1,
      "bbox": {
        "page": 1,
        "x": 500,
        "y": 380,
        "w": 80,
        "h": 80
      }
    },
    {
      "tagId": "tag-GV-1002",
      "tagNumber": "GV-1002",
      "symbolClass": "gate-valve",
      "lineNumber": "Discharge Isolation",
      "detectorConfidence": 1,
      "ocrConfidence": 1,
      "bbox": {
        "page": 1,
        "x": 650,
        "y": 400,
        "w": 50,
        "h": 40
      }
    },
    {
      "tagId": "tag-FV-2034",
      "tagNumber": "FV-2034",
      "symbolClass": "flow-control-valve",
      "lineNumber": "Charge Flow Control",
      "detectorConfidence": 1,
      "ocrConfidence": 1,
      "bbox": {
        "page": 1,
        "x": 780,
        "y": 390,
        "w": 60,
        "h": 60
      }
    },
    {
      "tagId": "tag-FT-2034",
      "tagNumber": "FT-2034",
      "symbolClass": "flow-transmitter",
      "lineNumber": "Flow Sensing",
      "detectorConfidence": 1,
      "ocrConfidence": 1,
      "bbox": {
        "page": 1,
        "x": 800,
        "y": 300,
        "w": 40,
        "h": 40
      }
    },
    {
      "tagId": "tag-V-102",
      "tagNumber": "V-102",
      "symbolClass": "pressure-vessel",
      "lineNumber": "Crude Fractionator",
      "detectorConfidence": 1,
      "ocrConfidence": 1,
      "bbox": {
        "page": 1,
        "x": 950,
        "y": 320,
        "w": 90,
        "h": 140
      }
    },
    {
      "tagId": "tag-P-101B",
      "tagNumber": "P-101B",
      "symbolClass": "centrifugal-pump",
      "lineNumber": "Charge Pump (Standby)",
      "detectorConfidence": 1,
      "ocrConfidence": 1,
      "bbox": {
        "page": 1,
        "x": 1180,
        "y": 380,
        "w": 80,
        "h": 80
      }
    },
    {
      "tagId": "tag-GV-1003",
      "tagNumber": "GV-1003",
      "symbolClass": "gate-valve",
      "lineNumber": "Standby Isolation",
      "detectorConfidence": 1,
      "ocrConfidence": 1,
      "bbox": {
        "page": 1,
        "x": 1320,
        "y": 400,
        "w": 50,
        "h": 40
      }
    },
    {
      "tagId": "tag-FV-2035",
      "tagNumber": "FV-2035",
      "symbolClass": "flow-control-valve",
      "lineNumber": "Recycle Control Valve",
      "detectorConfidence": 1,
      "ocrConfidence": 1,
      "bbox": {
        "page": 1,
        "x": 500,
        "y": 600,
        "w": 60,
        "h": 60
      }
    },
    {
      "tagId": "tag-FT-2035",
      "tagNumber": "FT-2035",
      "symbolClass": "flow-transmitter",
      "lineNumber": "Recycle Flow Sensing",
      "detectorConfidence": 1,
      "ocrConfidence": 1,
      "bbox": {
        "page": 1,
        "x": 520,
        "y": 520,
        "w": 40,
        "h": 40
      }
    },
    {
      "tagId": "tag-GV-1004",
      "tagNumber": "GV-1004",
      "symbolClass": "gate-valve",
      "lineNumber": "Recycle Isolation",
      "detectorConfidence": 1,
      "ocrConfidence": 1,
      "bbox": {
        "page": 1,
        "x": 780,
        "y": 600,
        "w": 50,
        "h": 40
      }
    }
  ],
  "connections": [
    {
      "fromTagId": "tag-V-101",
      "toTagId": "tag-GV-1001",
      "lineNumber": "L-101"
    },
    {
      "fromTagId": "tag-GV-1001",
      "toTagId": "tag-P-101A",
      "lineNumber": "L-101"
    },
    {
      "fromTagId": "tag-P-101A",
      "toTagId": "tag-GV-1002",
      "lineNumber": "L-102"
    },
    {
      "fromTagId": "tag-GV-1002",
      "toTagId": "tag-FV-2034",
      "lineNumber": "L-102"
    },
    {
      "fromTagId": "tag-FV-2034",
      "toTagId": "tag-V-102",
      "lineNumber": "L-103"
    }
  ]
}